{
    "$schema": "./build-config.schema.json",
    "Manufacturer": "Pankha Fan Control",
    "Product": "Pankha Windows Agent",
    "UpgradeCode": "08BB88C1-6D1D-476C-98A0-21019082B4F8",
    "Paths": {
        "WixBin": "%UserProfile%\\.nuget\\packages\\wixsharp.wix.bin\\3.10.0\\bin",
        "BuildArtifacts": "publish\\win-x64\\agent\\",
        "InstallerOutput": "publish\\win-x64\\installer\\",
        "AppIcon_256": "graphics\\icons\\pankha_icon_256x256_6-fins.ico"
    },
    "Filenames": {
        "AgentExe": "pankha-agent.exe",
        "AgentUI": "pankha-tray.exe",
        "InstallerMsi": "pankha-agent-windows_x64.msi",
        "InstallerExe": "pankha-agent-windows_setup_x64.exe",
        "ShortName": "Pankha Agent"
    },
    "Branding": {
        "ColorPrimary": "#384569",
        "ColorSecondary": "#1d2a4d",
        "BannerFlag": "graphics\\banners\\BannerFlag_128x128.png",
        "BannerWidth": 72,
        "BannerHeight": 64,
        "BannerRightMargin": 16
    }
}